{
  "fixtureResultSchemaVersion": "alto9.io/classifier-fixture-result/v1alpha1",
  "fixtureId": "ex-terraform-prod-mutation",
  "toolFamily": "terraform",
  "classifierLabels": [
    "resource-update"
  ],
  "changeTypes": [
    "resource-update"
  ],
  "resourceIdentities": [
    "aws_s3_bucket.prod_app"
  ],
  "parserLimitations": []
}
