{
  "fixtureResultSchemaVersion": "alto9.io/classifier-fixture-result/v1alpha1",
  "fixtureId": "ex-cdk-dev-low-risk",
  "toolFamily": "cdk",
  "matchedRules": [
    {
      "ruleId": "allow-low-risk-dev-iac",
      "decision": "allow",
      "severity": "low",
      "classifierLabel": "resource-create",
      "resourceIdentity": "DevLogsBucket",
      "reason": "Low-risk development infrastructure changes stay fast.",
      "riskSummary": "Routine development change with low blast radius and no production authority expansion.",
      "changeTypes": [
        "resource-create"
      ]
    }
  ],
  "evidenceReferences": [
    {
      "kind": "envelope",
      "path": "input/envelope.json"
    },
    {
      "kind": "artifact",
      "path": "input/artifact.json"
    },
    {
      "kind": "policyDocument",
      "digest": "sha256:7b06cb981615373e33b41a16cfa7d2f78bae52ce7e5ab542703a80ddeffff385"
    },
    {
      "kind": "manifest",
      "digest": "sha256:2e3084c46a00b474c79e010af88bf6e6bab6395a0ac4db8faa424e87aabd5301"
    }
  ]
}
