{
  "fixtureResultSchemaVersion": "alto9.io/classifier-fixture-result/v1alpha1",
  "fixtureId": "ex-terraform-prod-destructive-break-glass",
  "toolFamily": "terraform",
  "matchedRules": [
    {
      "ruleId": "require-approval-prod-destructive-break-glass",
      "decision": "require_approval",
      "severity": "critical",
      "classifierLabel": "database-delete",
      "resourceIdentity": "aws_rds_cluster.legacy",
      "reason": "Destructive production change submitted under break-glass requires explicit approval.",
      "riskSummary": "Destructive production change under break-glass still needs explicit human approval before proceed.",
      "changeTypes": [
        "database-delete"
      ]
    }
  ],
  "evidenceReferences": [
    {
      "kind": "envelope",
      "path": "input/envelope.json"
    },
    {
      "kind": "artifact",
      "path": "input/artifact.json"
    },
    {
      "kind": "policyDocument",
      "digest": "sha256:7b06cb981615373e33b41a16cfa7d2f78bae52ce7e5ab542703a80ddeffff385"
    },
    {
      "kind": "manifest",
      "digest": "sha256:497599548f04eb02975c8e97142966825301167e920653584880c2a6528730ed"
    }
  ]
}
