{
  "fixtureResultSchemaVersion": "alto9.io/classifier-fixture-result/v1alpha1",
  "fixtureId": "ex-cf-prod-destructive",
  "toolFamily": "cloudformation",
  "classifierLabels": [
    "resource-destroy"
  ],
  "changeTypes": [
    "resource-destroy"
  ],
  "resourceIdentities": [
    "LegacyDatabase"
  ],
  "parserLimitations": []
}
