{
  "fixtureResultSchemaVersion": "alto9.io/classifier-fixture-result/v1alpha1",
  "fixtureId": "ex-cf-prod-cross-account",
  "toolFamily": "cloudformation",
  "matchedRules": [
    {
      "ruleId": "require-approval-prod-cross-account-access",
      "decision": "require_approval",
      "severity": "critical",
      "classifierLabel": "cross-account-access",
      "resourceIdentity": "SharedDataBucketPolicy",
      "reason": "Cross-account access expands blast radius across account boundaries.",
      "riskSummary": "Grants cross-account access and expands blast radius beyond a single account boundary.",
      "changeTypes": [
        "cross-account-access"
      ]
    }
  ],
  "evidenceReferences": [
    {
      "kind": "envelope",
      "path": "input/envelope.json"
    },
    {
      "kind": "artifact",
      "path": "input/artifact.json"
    },
    {
      "kind": "policyDocument",
      "digest": "sha256:7b06cb981615373e33b41a16cfa7d2f78bae52ce7e5ab542703a80ddeffff385"
    },
    {
      "kind": "manifest",
      "digest": "sha256:218861bd111a3f1c1e65814e54566895287b5b91b65a407cf31091ba09c45e2b"
    }
  ]
}
