{
  "fixtureResultSchemaVersion": "alto9.io/classifier-fixture-result/v1alpha1",
  "fixtureId": "ex-cdk-prod-mutation",
  "toolFamily": "cdk",
  "classifierLabels": [
    "resource-update"
  ],
  "changeTypes": [
    "resource-update"
  ],
  "resourceIdentities": [
    "ProdAppBucket"
  ],
  "parserLimitations": []
}
