{
  "fixtureResultSchemaVersion": "alto9.io/classifier-fixture-result/v1alpha1",
  "fixtureId": "ex-cdk-template-fingerprint-mismatch",
  "toolFamily": "cdk",
  "matchedRules": [
    {
      "ruleId": "require-approval-deploy-verification-mismatch",
      "decision": "require_approval",
      "severity": "high",
      "classifierLabel": "plan-fingerprint-mismatch",
      "resourceIdentity": "ProdAppBucket",
      "reason": "Deploy artifact or plan fingerprint changed after the prior approval.",
      "riskSummary": "Approved artifact no longer matches the deploy target; possible tampering or drift.",
      "changeTypes": [
        "plan-fingerprint-mismatch"
      ]
    },
    {
      "ruleId": "require-approval-prod-mutation",
      "decision": "require_approval",
      "severity": "medium",
      "classifierLabel": "resource-update",
      "resourceIdentity": "ProdAppBucket",
      "reason": "Production infrastructure mutation changes live systems and needs human review.",
      "riskSummary": "Changes live production resources; a mistaken apply could cause outage or data loss.",
      "changeTypes": [
        "resource-update"
      ]
    }
  ],
  "evidenceReferences": [
    {
      "kind": "envelope",
      "path": "input/envelope.json"
    },
    {
      "kind": "artifact",
      "path": "input/artifact.json"
    },
    {
      "kind": "policyDocument",
      "digest": "sha256:7b06cb981615373e33b41a16cfa7d2f78bae52ce7e5ab542703a80ddeffff385"
    },
    {
      "kind": "manifest",
      "digest": "sha256:2e3084c46a00b474c79e010af88bf6e6bab6395a0ac4db8faa424e87aabd5301"
    }
  ]
}
