{
  "fixtureResultSchemaVersion": "alto9.io/classifier-fixture-result/v1alpha1",
  "fixtureId": "ex-cdk-prod-new-role",
  "toolFamily": "cdk",
  "matchedRules": [
    {
      "ruleId": "require-approval-prod-new-role",
      "decision": "require_approval",
      "severity": "high",
      "classifierLabel": "new-role",
      "resourceIdentity": "BatchWorkerRole",
      "reason": "New or materially changed production roles change who can act in the account.",
      "riskSummary": "Introduces or changes production role identities and trust relationships.",
      "changeTypes": ["new-role"]
    }
  ],
  "evidenceReferences": [
    { "kind": "envelope", "path": "input/envelope.json" },
    { "kind": "artifact", "path": "input/artifact.json" },
    {
      "kind": "policyDocument",
      "digest": "sha256:7b06cb981615373e33b41a16cfa7d2f78bae52ce7e5ab542703a80ddeffff385"
    },
    {
      "kind": "manifest",
      "digest": "sha256:218861bd111a3f1c1e65814e54566895287b5b91b65a407cf31091ba09c45e2b"
    }
  ]
}
