{
  "fixtureResultSchemaVersion": "alto9.io/classifier-fixture-result/v1alpha1",
  "fixtureId": "ex-shadow-enforce-dev-allow",
  "toolFamily": "terraform",
  "classifierLabels": [
    "resource-create"
  ],
  "changeTypes": [
    "resource-create"
  ],
  "resourceIdentities": [
    "aws_s3_bucket.dev_logs"
  ],
  "parserLimitations": []
}
